{
  "$schema": "../../schemas/event-sequence.schema.json",
  "schema_version": "1.0.0",
  "story_key": "order-expedite-01",
  "scenario": "hctm_order_expedite_01",
  "correlation_id": "corr-so-202607-0001",
  "events": [
    {
      "sequence": 1,
      "event_id": "evt-20260701-0001",
      "tenant_id": "tenant-hctm",
      "event_type": "o2d.order.received",
      "subject": "iaos.tenant-hctm.o2d.order.received",
      "source": "aese.hctm.simulator",
      "timestamp": "2026-07-01T09:00:00+08:00",
      "payload": {"order_no":"SO-202607-0001","customer_code":"CUST-SGNEV","material_code":"HCTM-BCP-A01","order_qty":10000,"due_date":"2026-07-20","priority":"high","delivery_policy":"split_allowed_final_due_fixed"},
      "metadata": {"correlation_id":"corr-so-202607-0001","scenario":"hctm_order_expedite_01","plant_code":"PLT-SZ","business_object_type":"sales_order","business_object_id":"SO-202607-0001","idempotency_key":"tenant-hctm:o2d.order.received:SO-202607-0001:10000:2026-07-20"}
    },
    {
      "sequence": 2,
      "event_id": "evt-20260701-0002",
      "tenant_id": "tenant-hctm",
      "event_type": "o2d.order.received",
      "subject": "iaos.tenant-hctm.o2d.order.received",
      "source": "aese.hctm.simulator",
      "timestamp": "2026-07-01T09:30:00+08:00",
      "payload": {"order_no":"SO-202607-0001-ADD1","customer_code":"CUST-SGNEV","material_code":"HCTM-BCP-A01","order_qty":2000,"additional_qty":2000,"due_date":"2026-07-20","priority":"high","delivery_policy":"split_allowed_final_due_fixed","original_order_no":"SO-202607-0001"},
      "metadata": {"correlation_id":"corr-so-202607-0001","causation_id":"evt-20260701-0001","scenario":"hctm_order_expedite_01","plant_code":"PLT-SZ","business_object_type":"sales_order","business_object_id":"SO-202607-0001-ADD1","idempotency_key":"tenant-hctm:o2d.order.received:SO-202607-0001-ADD1:2000:2026-07-20"}
    },
    {
      "sequence": 3,
      "event_id": "evt-20260701-0003",
      "tenant_id": "tenant-hctm",
      "event_type": "o2d.order.confirmed",
      "subject": "iaos.tenant-hctm.o2d.order.confirmed",
      "source": "aese.hctm.simulator",
      "timestamp": "2026-07-01T10:10:00+08:00",
      "payload": {"order_no":"SO-202607-0001","customer_code":"CUST-SGNEV","material_code":"HCTM-BCP-A01","confirmed_qty":12000,"due_date":"2026-07-20","plant_code":"PLT-SZ","confirmed_by":"EMP-SH-SALES-001","confirmed_at":"2026-07-01T10:10:00+08:00"},
      "metadata": {"correlation_id":"corr-so-202607-0001","causation_id":"evt-20260701-0002","scenario":"hctm_order_expedite_01","plant_code":"PLT-SZ","business_object_type":"sales_order","business_object_id":"SO-202607-0001","idempotency_key":"tenant-hctm:o2d.order.confirmed:SO-202607-0001:12000:2026-07-20"}
    },
    {
      "sequence": 4,
      "event_id": "evt-20260701-0004",
      "tenant_id": "tenant-hctm",
      "event_type": "o2d.mrp.generated",
      "subject": "iaos.tenant-hctm.o2d.mrp.generated",
      "source": "aese.hctm.simulator",
      "timestamp": "2026-07-01T10:20:00+08:00",
      "payload": {"mrp_run_id":"MRP-202607-0001","run_reason":"initial_plan","order_no":"SO-202607-0001","material_code":"HCTM-BCP-A01","demand_qty":12000,"available_finished_goods_qty":1200,"net_production_qty":10800,"material_shortages":[{"material_code":"AL-PLATE-6061-T6","required_qty":12600,"available_qty":8000,"in_transit_qty":5000,"shortage_qty":0,"timing_risk":"none"}],"capacity_risks":[],"recommended_actions":["release_purchase_order_PO-202607-0001","prepare_production_order_WO-202607-0001"]},
      "metadata": {"correlation_id":"corr-so-202607-0001","causation_id":"evt-20260701-0003","scenario":"hctm_order_expedite_01","plant_code":"PLT-SZ","business_object_type":"sales_order","business_object_id":"SO-202607-0001","idempotency_key":"tenant-hctm:o2d.mrp.generated:MRP-202607-0001"}
    },
    {
      "sequence": 5,
      "event_id": "evt-20260701-0005",
      "tenant_id": "tenant-hctm",
      "event_type": "o2d.purchase_requirement.created",
      "subject": "iaos.tenant-hctm.o2d.purchase_requirement.created",
      "source": "aese.hctm.simulator",
      "timestamp": "2026-07-01T10:25:00+08:00",
      "payload": {"requirement_no":"PR-202607-0001","mrp_run_id":"MRP-202607-0001","material_code":"AL-PLATE-6061-T6","required_qty":2000,"need_by_date":"2026-07-12","preferred_supplier_code":"SUP-BETA-AL","reason":"timing_risk"},
      "metadata": {"correlation_id":"corr-so-202607-0001","causation_id":"evt-20260701-0004","scenario":"hctm_order_expedite_01","plant_code":"PLT-SZ","business_object_type":"sales_order","business_object_id":"SO-202607-0001","idempotency_key":"tenant-hctm:o2d.purchase_requirement.created:PR-202607-0001"}
    },
    {
      "sequence": 6,
      "event_id": "evt-20260701-0006",
      "tenant_id": "tenant-hctm",
      "event_type": "o2d.purchase_order.released",
      "subject": "iaos.tenant-hctm.o2d.purchase_order.released",
      "source": "aese.hctm.simulator",
      "timestamp": "2026-07-01T11:00:00+08:00",
      "payload": {"po_no":"PO-202607-0001","supplier_code":"SUP-ALPHA-AL","material_code":"AL-PLATE-6061-T6","order_qty":5000,"promised_date":"2026-07-08","plant_code":"PLT-SZ","expedite_flag":false},
      "metadata": {"correlation_id":"corr-so-202607-0001","causation_id":"evt-20260701-0005","scenario":"hctm_order_expedite_01","plant_code":"PLT-SZ","business_object_type":"purchase_order","business_object_id":"PO-202607-0001","idempotency_key":"tenant-hctm:o2d.purchase_order.released:PO-202607-0001"}
    },
    {
      "sequence": 7,
      "event_id": "evt-20260702-0001",
      "tenant_id": "tenant-hctm",
      "event_type": "o2d.supplier_shipment.dispatched",
      "subject": "iaos.tenant-hctm.o2d.supplier_shipment.dispatched",
      "source": "aese.hctm.simulator",
      "timestamp": "2026-07-02T15:00:00+08:00",
      "payload": {"po_no":"PO-202607-0001","supplier_code":"SUP-ALPHA-AL","supplier_lot_no":"ALPHA-20260711-01","shipped_qty":5000,"eta":"2026-07-08","carrier":"安铝物流"},
      "metadata": {"correlation_id":"corr-so-202607-0001","causation_id":"evt-20260701-0006","scenario":"hctm_order_expedite_01","plant_code":"PLT-SZ","business_object_type":"purchase_order","business_object_id":"PO-202607-0001","idempotency_key":"tenant-hctm:o2d.supplier_shipment.dispatched:PO-202607-0001:ALPHA-20260711-01"}
    },
    {
      "sequence": 8,
      "event_id": "evt-20260708-0001",
      "tenant_id": "tenant-hctm",
      "event_type": "o2d.supplier_delivery.delayed",
      "subject": "iaos.tenant-hctm.o2d.supplier_delivery.delayed",
      "source": "aese.hctm.simulator",
      "timestamp": "2026-07-08T09:00:00+08:00",
      "payload": {"po_no":"PO-202607-0001","supplier_code":"SUP-ALPHA-AL","material_code":"AL-PLATE-6061-T6","original_eta":"2026-07-08","new_eta":"2026-07-11","delay_days":3,"reason":"供应商熔炼排产延迟","affected_order_no":"SO-202607-0001"},
      "metadata": {"correlation_id":"corr-so-202607-0001","causation_id":"evt-20260702-0001","scenario":"hctm_order_expedite_01","plant_code":"PLT-SZ","business_object_type":"purchase_order","business_object_id":"PO-202607-0001","idempotency_key":"tenant-hctm:o2d.supplier_delivery.delayed:PO-202607-0001:2026-07-11"}
    },
    {
      "sequence": 9,
      "event_id": "evt-20260708-0002",
      "tenant_id": "tenant-hctm",
      "event_type": "eam.machine.down",
      "subject": "iaos.tenant-hctm.eam.machine.down",
      "source": "aese.hctm.simulator",
      "timestamp": "2026-07-08T09:30:00+08:00",
      "payload": {"equipment_code":"LAS-WLD-02","work_center_code":"WLD-02","plant_code":"PLT-SZ","down_at":"2026-07-08T09:30:00+08:00","expected_repair_at":"2026-07-08T17:30:00+08:00","expected_down_hours":8,"capacity_loss_ratio":0.35,"reason_code":"LASER_POWER_ALARM","affected_task_no":"OPT-202607-0001-030"},
      "metadata": {"correlation_id":"corr-so-202607-0001","causation_id":"evt-20260708-0001","scenario":"hctm_order_expedite_01","plant_code":"PLT-SZ","business_object_type":"equipment","business_object_id":"LAS-WLD-02","idempotency_key":"tenant-hctm:eam.machine.down:LAS-WLD-02:2026-07-08T09:30:00+08:00"}
    },
    {
      "sequence": 10,
      "event_id": "evt-20260708-0003",
      "tenant_id": "tenant-hctm",
      "event_type": "o2d.mrp.generated",
      "subject": "iaos.tenant-hctm.o2d.mrp.generated",
      "source": "aese.hctm.simulator",
      "timestamp": "2026-07-08T09:40:00+08:00",
      "payload": {"mrp_run_id":"MRP-202607-0002","run_reason":"exception_replan","order_no":"SO-202607-0001","material_code":"HCTM-BCP-A01","demand_qty":12000,"available_finished_goods_qty":1200,"net_production_qty":10800,"material_shortages":[{"material_code":"AL-PLATE-6061-T6","required_qty":12600,"available_qty":8000,"in_transit_qty":5000,"shortage_qty":0,"timing_risk":"supplier_eta_delayed"}],"capacity_risks":[{"work_center_code":"WLD-02","equipment_code":"LAS-WLD-02","risk_type":"machine_down","impact_qty":280,"risk_level":"high"}],"recommended_actions":["release_backup_supplier_po_PO-202607-0002","enable_overtime_SHIFT-OT","split_shipment_9000_plus_3000","tighten_incoming_inspection_for_SUP-BETA-AL"]},
      "metadata": {"correlation_id":"corr-so-202607-0001","causation_id":"evt-20260708-0002","scenario":"hctm_order_expedite_01","plant_code":"PLT-SZ","business_object_type":"sales_order","business_object_id":"SO-202607-0001","idempotency_key":"tenant-hctm:o2d.mrp.generated:MRP-202607-0002"}
    },
    {
      "sequence": 11,
      "event_id": "evt-20260708-0004",
      "tenant_id": "tenant-hctm",
      "event_type": "o2d.purchase_order.released",
      "subject": "iaos.tenant-hctm.o2d.purchase_order.released",
      "source": "aese.hctm.simulator",
      "timestamp": "2026-07-08T10:20:00+08:00",
      "payload": {"po_no":"PO-202607-0002","supplier_code":"SUP-BETA-AL","material_code":"AL-PLATE-6061-T6","order_qty":2000,"promised_date":"2026-07-12","plant_code":"PLT-SZ","expedite_flag":true},